{
  "schemaVersion": "1.0.0",
  "manifestId": "moonwitness-lost-archives",
  "asOf": "2026-10-23",
  "policy": {
    "sourceStates": ["REPO_PRESENT", "USER_FILE_LOCATED", "CONVERSATION_REFERENCE", "EXTERNAL_VERIFIED", "UNLOCATED", "INFERRED_DRAFT"],
    "privateSourceRule": "Library filenames and conversation references are locators only; do not import or publish without authorized export and review.",
    "unknownValues": "Use null or UNKNOWN; do not infer missing content, chronology, authorship, rights, or approval."
  },
  "collections": [
    { "id": "ARC-05", "title": "Tick-tock / Menggigil / Thunderstruck", "evidence": "https://github.com/bjo163/A-L-L-A-H/issues/73", "sourceState": "CONVERSATION_REFERENCE", "coverage": { "sourcesDiscovered": 1, "bytesCaptured": 0, "textReviewed": 0, "approved": 0, "mediaPaired": 0, "published": 0 } },
    { "id": "ARC-06", "title": "MOONWITNESS XII (8/33 V4)", "evidence": "https://github.com/bjo163/A-L-L-A-H/issues/74", "sourceState": "CONVERSATION_REFERENCE", "coverage": { "sourcesDiscovered": 1, "bytesCaptured": 0, "textReviewed": 0, "approved": 0, "mediaPaired": 0, "published": 0 } },
    { "id": "ARC-07", "title": "THE BATTERIES + NPD TEAM", "evidence": "https://github.com/bjo163/A-L-L-A-H/issues/75", "sourceState": "CONVERSATION_REFERENCE", "coverage": { "sourcesDiscovered": 1, "bytesCaptured": 0, "textReviewed": 0, "approved": 0, "mediaPaired": 0, "published": 0 } },
    { "id": "ARC-08", "title": "REAL FEAST / Penunggang Angsa", "evidence": "https://github.com/bjo163/A-L-L-A-H/issues/76", "sourceState": "CONVERSATION_REFERENCE", "coverage": { "sourcesDiscovered": 1, "bytesCaptured": 0, "textReviewed": 0, "approved": 0, "mediaPaired": 0, "published": 0 } },
    { "id": "ARC-09", "title": "ALLAH-PROMISE", "evidence": "https://github.com/bjo163/A-L-L-A-H/issues/77", "sourceState": "CONVERSATION_REFERENCE", "coverage": { "sourcesDiscovered": 1, "bytesCaptured": 0, "textReviewed": 0, "approved": 0, "mediaPaired": 0, "published": 0 } },
    { "id": "ARC-10", "title": "GOD-PROMISE 1·6·3 research", "evidence": "https://github.com/bjo163/A-L-L-A-H/issues/78", "sourceState": "CONVERSATION_REFERENCE", "coverage": { "sourcesDiscovered": 1, "bytesCaptured": 0, "textReviewed": 0, "approved": 0, "mediaPaired": 0, "published": 0 } },
    { "id": "ARC-11", "title": "MOONRIDLEY", "evidence": "https://github.com/bjo163/A-L-L-A-H/issues/79", "sourceState": "CONVERSATION_REFERENCE", "coverage": { "sourcesDiscovered": 1, "bytesCaptured": 0, "textReviewed": 0, "approved": 0, "mediaPaired": 0, "published": 0 } },
    { "id": "ARC-12", "title": "ZILL Tasawuf", "evidence": "https://github.com/bjo163/A-L-L-A-H/issues/80", "sourceState": "CONVERSATION_REFERENCE", "coverage": { "sourcesDiscovered": 1, "bytesCaptured": 0, "textReviewed": 0, "approved": 0, "mediaPaired": 0, "published": 0 } },
    { "id": "ARC-13", "title": "PENDETA-ONLINE", "evidence": "https://github.com/bjo163/A-L-L-A-H/issues/81", "sourceState": "CONVERSATION_REFERENCE", "coverage": { "sourcesDiscovered": 1, "bytesCaptured": 0, "textReviewed": 0, "approved": 0, "mediaPaired": 0, "published": 0 } },
    { "id": "ARC-14", "title": "RE–ZA / RA-SOUL", "evidence": "https://github.com/bjo163/A-L-L-A-H/issues/82", "sourceState": "CONVERSATION_REFERENCE", "coverage": { "sourcesDiscovered": 1, "bytesCaptured": 0, "textReviewed": 0, "approved": 0, "mediaPaired": 0, "published": 0 } },
    { "id": "ARC-15", "title": "SINTERCLASS Hindu/Buddhist", "evidence": "https://github.com/bjo163/A-L-L-A-H/issues/83", "sourceState": "CONVERSATION_REFERENCE", "coverage": { "sourcesDiscovered": 1, "bytesCaptured": 0, "textReviewed": 0, "approved": 0, "mediaPaired": 0, "published": 0 } },
    { "id": "ARC-16", "title": "HONEY & MOON", "evidence": "https://github.com/bjo163/A-L-L-A-H/issues/84", "sourceState": "CONVERSATION_REFERENCE", "coverage": { "sourcesDiscovered": 1, "bytesCaptured": 0, "textReviewed": 0, "approved": 0, "mediaPaired": 0, "published": 0 } },
    { "id": "ARC-17", "title": "ASSAFAAT-30 + Qur'anic references", "evidence": "https://github.com/bjo163/A-L-L-A-H/issues/85", "sourceState": "CONVERSATION_REFERENCE", "coverage": { "sourcesDiscovered": 1, "bytesCaptured": 0, "textReviewed": 0, "approved": 0, "mediaPaired": 0, "published": 0 } },
    { "id": "ARC-18", "title": "ROCKSOUL / HoneyBee / Age", "evidence": "https://github.com/bjo163/A-L-L-A-H/issues/86", "sourceState": "CONVERSATION_REFERENCE", "coverage": { "sourcesDiscovered": 1, "bytesCaptured": 0, "textReviewed": 0, "approved": 0, "mediaPaired": 0, "published": 0 } },
    { "id": "ARC-19", "title": "SUNLIGHT-INTEL", "evidence": "https://github.com/bjo163/A-L-L-A-H/issues/87", "sourceState": "CONVERSATION_REFERENCE", "coverage": { "sourcesDiscovered": 1, "bytesCaptured": 0, "textReviewed": 0, "approved": 0, "mediaPaired": 0, "published": 0 } },
    { "id": "ARC-22", "title": "Unassigned fragment discovery", "evidence": "https://github.com/bjo163/A-L-L-A-H/issues/90", "sourceState": "CONVERSATION_REFERENCE", "coverage": { "sourcesDiscovered": 1, "bytesCaptured": 0, "textReviewed": 0, "approved": 0, "mediaPaired": 0, "published": 0 } }
  ],
  "artifacts": [
    {
      "artifactId": "repo:moonwitness-hero:3629ab7a",
      "collectionId": null,
      "title": "MoonWitness hero image (association to story collection not established)",
      "aliases": [],
      "sourceState": "REPO_PRESENT",
      "sourceLocator": "apps/web/public/images/moonwitness-hero.png",
      "version": "git:dev@ef8acbb72e93086f19ce02e0d889b22c1fd2f393",
      "sha256": "3629ab7a1c5ffef21f49abd38772ceb2761211dbed0a8d0f97704241c092aa5d",
      "bytes": 3284159,
      "derivedFrom": null,
      "author": null,
      "assetType": "image/png",
      "privacy": "repository-public",
      "rights": "UNKNOWN_REVIEW_REQUIRED",
      "attribution": null,
      "language": "NOT_APPLICABLE",
      "chronology": { "eventDate": null, "draftDate": null, "publishedDate": null },
      "contentClassification": "project-branding-asset; not verified as an archive illustration",
      "completeness": "UNKNOWN",
      "textReviewed": false,
      "mediaPaired": false,
      "editorialApproved": false,
      "published": false
    },
    {
      "artifactId": "library:pasted-markdown-20260918-190827",
      "collectionId": null,
      "title": "Pasted markdown(20260918-190827).md",
      "aliases": [],
      "sourceState": "USER_FILE_LOCATED",
      "sourceLocator": "User Library filename reported by issue #69; local bytes unavailable",
      "version": null,
      "sha256": null,
      "bytes": null,
      "derivedFrom": null,
      "author": null,
      "assetType": "text/markdown (from filename only)",
      "privacy": "private-source; export and destination review required",
      "rights": "UNKNOWN_REVIEW_REQUIRED",
      "attribution": null,
      "language": "UNKNOWN",
      "chronology": { "eventDate": null, "draftDate": null, "publishedDate": null },
      "contentClassification": "UNKNOWN",
      "completeness": "NOT_ACCESSIBLE",
      "textReviewed": false,
      "mediaPaired": false,
      "editorialApproved": false,
      "published": false
    },
    {
      "artifactId": "library:god-promise-moonwitness-research-paper",
      "collectionId": "ARC-10",
      "title": "GOD-PROMISE_MOONWITNESS_Research_Paper.md",
      "aliases": [],
      "sourceState": "USER_FILE_LOCATED",
      "sourceLocator": "User Library filename reported by issue #78; local bytes unavailable",
      "version": "locator says conceptual framework v1.0 dated 2026-09-16; unverified source metadata",
      "sha256": null,
      "bytes": null,
      "derivedFrom": null,
      "author": null,
      "assetType": "text/markdown (from filename only)",
      "privacy": "private-source; export and destination review required",
      "rights": "UNKNOWN_REVIEW_REQUIRED",
      "attribution": null,
      "language": "UNKNOWN",
      "chronology": { "eventDate": null, "draftDate": null, "publishedDate": null },
      "contentClassification": "research framework locator; original content not locally verified",
      "completeness": "NOT_ACCESSIBLE",
      "textReviewed": false,
      "mediaPaired": false,
      "editorialApproved": false,
      "published": false
    },
    {
      "artifactId": "library:moonwitness-tick-tock-bedroom-stories",
      "collectionId": "ARC-05",
      "title": "Moonwitness: Tick-Tock Bedroom Stories.png",
      "aliases": [],
      "sourceState": "USER_FILE_LOCATED",
      "sourceLocator": "User Library filename reported by issue #69; local bytes unavailable",
      "version": null,
      "sha256": null,
      "bytes": null,
      "derivedFrom": null,
      "author": null,
      "assetType": "image (extension only)",
      "privacy": "private-source; export and destination review required",
      "rights": "UNKNOWN_REVIEW_REQUIRED",
      "attribution": null,
      "language": "UNKNOWN",
      "chronology": { "eventDate": null, "draftDate": null, "publishedDate": null },
      "contentClassification": "UNKNOWN",
      "completeness": "NOT_ACCESSIBLE",
      "textReviewed": false,
      "mediaPaired": false,
      "editorialApproved": false,
      "published": false
    },
    {
      "artifactId": "library:neon-rain-dance-team-comic",
      "collectionId": "ARC-07",
      "title": "Neon Rain Dance Team Comic.png",
      "aliases": [],
      "sourceState": "USER_FILE_LOCATED",
      "sourceLocator": "User Library filename reported by issue #69; local bytes unavailable",
      "version": null,
      "sha256": null,
      "bytes": null,
      "derivedFrom": null,
      "author": null,
      "assetType": "image (extension only)",
      "privacy": "private-source; export and destination review required",
      "rights": "UNKNOWN_REVIEW_REQUIRED",
      "attribution": null,
      "language": "UNKNOWN",
      "chronology": { "eventDate": null, "draftDate": null, "publishedDate": null },
      "contentClassification": "UNKNOWN",